{
  "domain": "navigation-standard-gap",
  "version": 2,
  "sample_id": "public-sample-007",
  "as_of": "2026-09-27",
  "actors": [
    "学员",
    "授课专家",
    "主办机构",
    "成员国主管部门",
    "联合项目办公室"
  ],
  "facts": [
    "培训由交通运输部海事局与国际航标组织联合主办",
    "项目新增风险管理专项培训",
    "历史学员来自四十多个国家和地区",
    "联合项目办公室维护国际条款与各成员机构实施情况的逐项对应差距库",
    "证书数量不作为标准落地的判定依据，差距以条款级证据与复核结论为准"
  ],
  "constraints": [
    "国际条款映射：条款原文、官方译文与勘误、本国规范逐项对应",
    "译文勘误只追加不回溯，已冻结旧版培训资料不改写",
    "国家规则更新只关闭确已解决的差距",
    "现场豁免必须有批准人与到期日，到期失效且不得用于关闭差距",
    "成员机构自评后须由异国民用航标主管机构同行复核",
    "证据可持续补充，含敏感设施信息的证据按国家隔离",
    "改进行动延期须记录批准人、理由与更晚的新期限",
    "需演练验证的改进未通过实际演练前不得关闭差距",
    "管理者按条款查看仍影响服务一致性的差距"
  ],
  "imports": [
    {
      "id": "IMP-2026-001",
      "imported_on": "2026-09-20",
      "source": "联合培训项目已有课程与风险场景库（虚构样例导入）",
      "course_ids": ["CR-RISK-2024", "CR-RISK-2026", "CR-EQ-2025"],
      "scenario_ids": ["RS-001", "RS-002", "RS-003"],
      "note": "首批导入；历史课程按发布时快照冻结保存"
    }
  ],
  "standards_clauses": [
    {
      "id": "C-3101",
      "standard": "IALA-R-0101（虚构编号）",
      "number": "3.1.1",
      "title": "风险等级术语",
      "text_summary": "导助航服务应使用统一的风险等级名称与释义，区分低、较高、高三级并配套判定口径。",
      "consistency_aspect": "risk_terminology",
      "status": "current"
    },
    {
      "id": "C-3102",
      "standard": "IALA-R-0101（虚构编号）",
      "number": "3.1.2",
      "title": "风险沟通用语",
      "text_summary": "对外发布航行警告时应使用标准风险沟通用语，避免自行创设含义不明的措辞。",
      "consistency_aspect": "risk_terminology",
      "status": "current"
    },
    {
      "id": "C-4210",
      "standard": "IALA-R-0101（虚构编号）",
      "number": "4.2.10",
      "title": "虚拟航标发射与监控",
      "text_summary": "虚拟AIS航标发射功率与位置校核周期应满足建议下限，监控周期不超过5分钟。",
      "consistency_aspect": "equipment_capability",
      "status": "current"
    },
    {
      "id": "C-4330",
      "standard": "IALA-R-0101（虚构编号）",
      "number": "4.3.30",
      "title": "航标站备用电源续航",
      "text_summary": "关键航标站备用电源在主供水中断后应至少维持72小时连续工作。",
      "consistency_aspect": "equipment_capability",
      "status": "current"
    },
    {
      "id": "C-5200",
      "standard": "IALA-R-0101（虚构编号）",
      "number": "5.2.0",
      "title": "灯浮漂移处置流程",
      "text_summary": "发现灯浮漂移后应在4小时内完成现场核实并上报，按统一流程发布临时警告并组织复位。",
      "consistency_aspect": "response_process",
      "status": "current"
    },
    {
      "id": "C-5310",
      "standard": "IALA-R-0101（虚构编号）",
      "number": "5.3.10",
      "title": "能见度不良应急联动",
      "text_summary": "能见度低于阈值时，航标、VTS与搜救值班单位应按联动流程在规定时限内互换信息。",
      "consistency_aspect": "response_process",
      "status": "current"
    }
  ],
  "translations": [
    {
      "id": "T-3101-v1",
      "clause_id": "C-3101",
      "language": "zh-CN",
      "version": 1,
      "published_on": "2023-02-01",
      "text": "风险等级分为低、显著、高三级。（旧版译文，术语已被勘误）",
      "status": "superseded"
    },
    {
      "id": "T-3101-v2",
      "clause_id": "C-3101",
      "language": "zh-CN",
      "version": 2,
      "published_on": "2025-11-10",
      "text": "风险等级分为低、较高、高三级，并附判定口径。",
      "status": "current"
    },
    {
      "id": "T-3102-v1",
      "clause_id": "C-3102",
      "language": "zh-CN",
      "version": 1,
      "published_on": "2025-11-10",
      "text": "航行警告应使用标准风险沟通用语。",
      "status": "current"
    },
    {
      "id": "T-4210-v1",
      "clause_id": "C-4210",
      "language": "zh-CN",
      "version": 1,
      "published_on": "2024-05-01",
      "text": "虚拟AIS航标监控周期不超过5分钟。",
      "status": "current"
    },
    {
      "id": "T-4330-v1",
      "clause_id": "C-4330",
      "language": "zh-CN",
      "version": 1,
      "published_on": "2024-05-01",
      "text": "关键航标站备用电源应至少维持72小时。",
      "status": "current"
    },
    {
      "id": "T-5200-v1",
      "clause_id": "C-5200",
      "language": "zh-CN",
      "version": 1,
      "published_on": "2024-05-01",
      "text": "发现灯浮漂移后应在4小时内上报。（初版译文，时限义务范围已被勘误补全）",
      "status": "current"
    },
    {
      "id": "T-5310-v1",
      "clause_id": "C-5310",
      "language": "zh-CN",
      "version": 1,
      "published_on": "2024-05-01",
      "text": "能见度低于阈值时相关单位应及时联动互换信息。",
      "status": "current"
    }
  ],
  "translation_corrigenda": [
    {
      "id": "ER-001",
      "translation_id": "T-3101-v1",
      "published_on": "2025-11-10",
      "severity": "terminology",
      "original_reading": "显著风险",
      "corrected_reading": "较高风险",
      "note": "与国际统一风险分级对齐；旧版冻结课程不回溯改写，由新版课程纳入。"
    },
    {
      "id": "ER-002",
      "translation_id": "T-5200-v1",
      "published_on": "2026-03-15",
      "severity": "meaning",
      "original_reading": "4小时内上报",
      "corrected_reading": "4小时内完成现场核实并上报",
      "note": "补全时限义务包含现场核实，仅发布勘误，已发课程资料保持原样。"
    }
  ],
  "national_rules": [
    {
      "id": "NR-CN-01",
      "country_code": "CN",
      "title": "海上交通安全管理实施细则（虚构）",
      "clause_ids": ["C-5200", "C-5310"],
      "effective_on": "2022-07-01",
      "status": "in_force"
    },
    {
      "id": "NR-CN-02",
      "country_code": "CN",
      "title": "导助航风险术语应用通知（虚构）",
      "clause_ids": ["C-3101", "C-3102"],
      "effective_on": "2026-01-01",
      "status": "in_force",
      "note": "采用较高风险等标准译名，但不改变已结业课程资料。"
    },
    {
      "id": "NR-MY-01",
      "country_code": "MY",
      "title": "Malaysian AtoN Response Directive (fictional)",
      "clause_ids": ["C-5200"],
      "effective_on": "2026-04-01",
      "status": "in_force"
    },
    {
      "id": "NR-EG-01",
      "country_code": "EG",
      "title": "Red Sea Aids to Navigation Equipment Order (fictional)",
      "clause_ids": ["C-4210"],
      "effective_on": "2023-10-01",
      "status": "in_force"
    }
  ],
  "courses": [
    {
      "id": "CR-RISK-2024",
      "code": "RISK-201",
      "title": "导助航风险管理专项培训（2024班）",
      "version": "2024.1",
      "published_on": "2024-09-01",
      "frozen": true,
      "based_on_translation_ids": ["T-3101-v1"],
      "snapshot_note": "按发布时译文快照冻结，仍使用‘显著风险’旧术语，勘误不回溯。"
    },
    {
      "id": "CR-RISK-2026",
      "code": "RISK-201",
      "title": "导助航风险管理专项培训（2026班）",
      "version": "2026.1",
      "published_on": "2026-02-01",
      "frozen": true,
      "based_on_translation_ids": ["T-3101-v2", "T-3102-v1"],
      "includes_corrigenda_ids": ["ER-001"]
    },
    {
      "id": "CR-EQ-2025",
      "code": "EQP-110",
      "title": "航标设备与应急流程课程（2025版）",
      "version": "2025.2",
      "published_on": "2025-06-01",
      "frozen": true,
      "based_on_translation_ids": ["T-4210-v1", "T-4330-v1", "T-5200-v1", "T-5310-v1"],
      "snapshot_note": "早于 ER-002 发布，灯浮漂移章节只写‘4小时内上报’。"
    }
  ],
  "risk_scenarios": [
    {
      "id": "RS-001",
      "code": "RS-FOG-DRIFT",
      "title": "浓雾期间灯浮漂移",
      "summary": "能见度不足200米时某进口灯浮漂移，需在4小时内完成核实、警告发布与联动。",
      "clause_ids": ["C-5200", "C-5310"],
      "source_course_id": "CR-RISK-2024"
    },
    {
      "id": "RS-002",
      "code": "RS-AIS-LOST",
      "title": "虚拟AIS航标信号丢失",
      "summary": "虚拟航标信号中断且监控周期超标，需评估设备能力并启动应急标识。",
      "clause_ids": ["C-4210"],
      "source_course_id": "CR-EQ-2025"
    },
    {
      "id": "RS-003",
      "code": "RS-POWER-OUT",
      "title": "关键航标站主供水中断",
      "summary": "主供水中断后依靠备用电源，检验续航能否达到72小时并完成补给。",
      "clause_ids": ["C-4330"],
      "source_course_id": "CR-EQ-2025"
    }
  ],
  "agencies": [
    { "id": "CN-MSA-DH", "name": "东海航海保障中心（虚构样例机构）", "country_code": "CN" },
    { "id": "MY-MARITIME", "name": "Peninsular AtoN Authority (fictional)", "country_code": "MY" },
    { "id": "EG-RSA", "name": "Red Sea AtoN Service (fictional)", "country_code": "EG" },
    { "id": "JPO", "name": "联合项目办公室", "country_code": "XN" }
  ],
  "facilities": [
    {
      "id": "F-CN-001",
      "label": "长江口某航标站（敏感，详情虚构）",
      "country_code": "CN",
      "agency_id": "CN-MSA-DH",
      "sensitive": true,
      "equipment_limits": [
        "虚拟AIS发射功率低于条款建议下限",
        "备用电源续航约24小时，低于72小时要求"
      ]
    },
    {
      "id": "F-MY-001",
      "label": "马六甲海峡某航标站（虚构）",
      "country_code": "MY",
      "agency_id": "MY-MARITIME",
      "sensitive": false,
      "equipment_limits": ["备用电源续航约48小时，低于72小时要求"]
    },
    {
      "id": "F-EG-001",
      "label": "红海某敏感航标站（详情虚构）",
      "country_code": "EG",
      "agency_id": "EG-RSA",
      "sensitive": true,
      "equipment_limits": [
        "虚拟AIS位置校核周期约12分钟，超过5分钟上限",
        "监控链路在沙尘暴期间中断无冗余"
      ]
    }
  ],
  "gaps": [
    {
      "id": "G-CN-001",
      "clause_id": "C-3101",
      "country_code": "CN",
      "agency_id": "CN-MSA-DH",
      "kind": "course_material_frozen",
      "title": "2024冻结课程仍讲授‘显著风险’旧术语",
      "description": "ER-001 已将术语勘误为‘较高风险’，但 CR-RISK-2024 为冻结快照，在岗轮训仍沿用旧讲义，现场风险通报用语不一致。",
      "affects_service_consistency": true,
      "self_assessed_on": "2026-05-12",
      "status": "open",
      "refs": {
        "translation_id": "T-3101-v1",
        "corrigendum_id": "ER-001",
        "course_id": "CR-RISK-2024"
      }
    },
    {
      "id": "G-CN-002",
      "clause_id": "C-4330",
      "country_code": "CN",
      "agency_id": "CN-MSA-DH",
      "kind": "equipment_capability",
      "title": "关键航标站备用电源续航不足且已通过演练整改",
      "description": "F-CN-001 备用电源续航约24小时。已加装电池组并完成72小时连续供电演练，由外方同行复核确认。",
      "affects_service_consistency": false,
      "self_assessed_on": "2026-03-02",
      "status": "closed",
      "refs": { "facility_id": "F-CN-001" },
      "closure": {
        "basis": "drill",
        "ref_id": "D-001",
        "closed_on": "2026-05-21",
        "closed_by": "JPO"
      }
    },
    {
      "id": "G-CN-003",
      "clause_id": "C-5310",
      "country_code": "CN",
      "agency_id": "CN-MSA-DH",
      "kind": "response_process",
      "title": "能见度不良联动时限未通过实际演练",
      "description": "新联动SOP已发布、行动标记完成、同行复核确认，但首次桌面与实操结合演练结果为部分通过，信息互换超时，差距不得关闭。",
      "affects_service_consistency": true,
      "self_assessed_on": "2026-04-18",
      "status": "open",
      "refs": { "national_rule_id": "NR-CN-01", "risk_scenario_id": "RS-001" }
    },
    {
      "id": "G-CN-004",
      "clause_id": "C-4210",